15384,Ontario,Haileybury,Electrical Engineering Technician – Level 3 for Instrumentation Graduates,http://www.northernc.on.ca/electrical-technician-level3/,Northern College of Applied Arts and Technology,14-Engineering,College
45356,Alberta,Lloydminster,2nd Class Power Engineering,http://lakelandcollege.ca/academics/energy-petroleum-technology/programs/2nd-class-power-engineering/overview/default.aspx,Lakeland College,14-Engineering,College
44309,Ontario,Toronto,4th Operating Power Engineering (Paper 4A),https://www.scbt.ca/programs/4th-operating-power-engineering-paper-4a/,Stanford International College of Business & Technology,14-Engineering,College
44310,Ontario,Toronto,4th Operating Power Engineering (Paper 4B),https://www.scbt.ca/programs/4th-operating-power-engineering-paper-4b/,Stanford International College of Business & Technology,14-Engineering,College
49637,Newfoundland and Labrador,Gander,Advanced Diploma in (EASA) - Aircraft Maintenance Engineering Technician,http://www.cna.nl.ca/program/aircraft-maintenance-engineering-technician-advanced-diploma,College of the North Atlantic,14-Engineering,College
34666,British Columbia,Victoria,Advanced Diploma in Engineering,http://camosun.ca/learn/programs/engineering-bridge/,Camosun College,14-Engineering,College
38730,Ontario,London,Advanced Diploma in Manufacturing Engineering Technology - Co-op,https://www.fanshawec.ca/programs/mey1-manufacturing-engineering-technology-co-op/next,Fanshawe College of Applied Arts and Technology,14-Engineering,College
38545,British Columbia,Kelowna,Aircraft Maintenance Engineer Category 'S' (Structures),http://webapps-5.okanagan.bc.ca/ok/calendar/calendar.aspx?page=AMES,Okanagan College,14-Engineering,College
40451,Saskatchewan,Saskatoon,Aircraft Maintenance Engineering,http://siit.ca/programs/aircraft-maintenance-engineering/,Saskatchewan Indian Institute of Technologies,14-Engineering,College
15855,British Columbia,Cranbrook,Arts and Sciences - University Studies  - Certificate in Engineering,https://cotr.bc.ca/programs/environmental-studies/,College of the Rockies,14-Engineering,College
43379,British Columbia,Kelowna,Audio Engineering & Production,https://digitalartschool.com/programs/audio-engineering-production,Centre for Arts And Technology,14-Engineering,College
32808,British Columbia,Kelowna,Audio Engineering and Music Production Certificate,http://webapps-5.okanagan.bc.ca/ok/Calendar/AudioEngineeringandMusicProduction,Okanagan College,14-Engineering,College
24645,Alberta,Calgary,Bachelor of Applied Technology Petroleum Engineering,https://www.sait.ca/programs-and-courses/degrees/bachelor-of-applied-technology-petroleum-engineering,Southern Alberta Institute of Technology (SAIT),14-Engineering,College
50462,Ontario,Barrie,Bachelor of Engineering - Electrical Engineering and Engineering Technology Advanced Diplom,https://www.lakeheadgeorgian.ca/programs/engineering-electrical/,Lakehead University,14-Engineering,College
50462,Ontario,Thunder Bay,Bachelor of Engineering - Electrical Engineering and Engineering Technology Advanced Diplom,https://www.lakeheadgeorgian.ca/programs/engineering-electrical/,Lakehead University,14-Engineering,College
14667,Alberta,Medicine Hat,Bachelor of Engineering - University Transfer Program,https://www.mhc.ab.ca/ProgramsandCourses/Academic-Programs/Programs-of-Study/Engineering,Medicine Hat College,14-Engineering,College
20070,Alberta,Grande Prairie,Bachelor of Science - Engineering,https://www.gprc.ab.ca/programs/ut-engineering.html,Grande Prairie Regional College,14-Engineering,College
14853,Alberta,Red Deer,Bachelor of Science in Engineering,https://www.rdc.ab.ca/programs,Red Deer College,14-Engineering,College
39721,Ontario,Toronto,Biomedical Engineering Technology (Co-op),https://www.centennialcollege.ca/programs-courses/full-time/biomedical-engineering-technology/,Centennial College of Applied Arts and Technology,14-Engineering,College
39722,Ontario,Toronto,Biomedical Engineering Technology (Fast Track),https://www.centennialcollege.ca/programs-courses/full-time/biomedical-engineering-technology-fast-track/,Centennial College of Applied Arts and Technology,14-Engineering,College
40790,Ontario,Windsor,Biomedical Engineering Technology - Equipment and Devices,http://www.stclaircollege.ca/programs/postsec/biomedical/,St. Clair College of Applied Arts and Technology,14-Engineering,College
46919,New Brunswick,Fredericton,Building Engineering Technology: Building Systems,https://nbcc.ca/programs-courses/program-details?baseCurriculumId=d3b88c2d-2b69-4c49-93a7-d89909a19a04,New Brunswick Community College,14-Engineering,College
46919,New Brunswick,Moncton,Building Engineering Technology: Building Systems,https://nbcc.ca/programs-courses/program-details?baseCurriculumId=d3b88c2d-2b69-4c49-93a7-d89909a19a04,New Brunswick Community College,14-Engineering,College
44316,Ontario,Mississauga,Building Services Engineering,https://www.scbt.ca/programs/building-services-engineering-full-time,Stanford International College of Business & Technology,14-Engineering,College
44316,Ontario,Scarborough,Building Services Engineering,https://www.scbt.ca/programs/building-services-engineering-full-time,Stanford International College of Business & Technology,14-Engineering,College
19472,Southport,Science and Technology,Certificate in Aerospace Manufacturing,https://me.rrc.mb.ca/catalogue/ProgramInfo.aspx?ProgCode=AERMF-CT&RegionCode=WPG,Red River College of Applied Arts,14-Engineering,College
19472,Winnipeg,Science and Technology,Certificate in Aerospace Manufacturing,https://me.rrc.mb.ca/catalogue/ProgramInfo.aspx?ProgCode=AERMF-CT&RegionCode=WPG,Red River College of Applied Arts,14-Engineering,College
32349,British Columbia,Castlegar,Certificate in Engineering,http://selkirk.ca/program/engineering,Selkirk College,14-Engineering,College
25287,British Columbia,Victoria,Certificate in Engineering Transfer,http://camosun.ca/learn/programs/engineering-transfer/index.html,Camosun College,14-Engineering,College
20433,British Columbia,Burnaby,Certificate in Operations Management - Industrial Engineering Option,https://www.bcit.ca/study/programs/690amcert,British Columbia Institute of Technology (BCIT),14-Engineering,College
20433,British Columbia,Vancouver,Certificate in Operations Management - Industrial Engineering Option,https://www.bcit.ca/study/programs/690amcert,British Columbia Institute of Technology (BCIT),14-Engineering,College
20442,British Columbia,Burnaby,Certificate in Operations Management - Management Engineering Option,https://www.bcit.ca/study/programs/690bmcert,British Columbia Institute of Technology (BCIT),14-Engineering,College
20442,British Columbia,Vancouver,Certificate in Operations Management - Management Engineering Option,https://www.bcit.ca/study/programs/690bmcert,British Columbia Institute of Technology (BCIT),14-Engineering,College
37235,British Columbia,Nelson,Certificate in Plant Operator,http://selkirk.ca/program/plant-operator,Selkirk College,14-Engineering,College
27070,Winnipeg,Science and Technology,Certificate in Power Engineering - 5th Class,https://catalogue.rrc.ca/Programs/WPG/Fulltime/POW5F-CT/Overview,Red River College of Applied Arts,14-Engineering,College
20572,British Columbia,Burnaby,Certificate in Power Engineering - General Program,https://www.bcit.ca/study/programs/2410ttcert,British Columbia Institute of Technology (BCIT),14-Engineering,College
37342,British Columbia,Prince George,Certificate in Power Engineering 3rd Class,https://cnc.bc.ca/programs-courses/programs/detail/power-engineering-3rd-class,College of New Caledonia,14-Engineering,College
17613,Ontario,St. Thomas,Certificate in Power Engineering Techniques - 4th Class,https://www.fanshawec.ca/programs/peq1s-power-engineering-techniques-4th-class/next,Fanshawe College of Applied Arts and Technology,14-Engineering,College
14958,Ontario,Toronto,Chemical Engineering Technology,http://www.senecacollege.ca/programs/fulltime/CHY.html,Seneca College,14-Engineering,College
24656,Alberta,Calgary,Chemical Engineering Technology,https://www.sait.ca/programs-and-courses/diplomas/chemical-engineering-technology,Southern Alberta Institute of Technology (SAIT),14-Engineering,College
14198,Ontario,Oshawa,Chemical Engineering Technology,https://durhamcollege.ca/programs/chemical-engineering-technology,Durham College of Applied Arts and Technology,14-Engineering,College
16877,Ontario,Hamilton,Chemical Engineering Technology,http://www.mohawkcollege.ca/engineering-technology-programs/chemical-engineering-technology-advanced-diploma.html,Mohawk College of Applied Arts and Technology,14-Engineering,College
13759,Ontario,Sudbury,Chemical Engineering Technology - Lab and Process Control (CHLP),http://catalog.cambriancollege.ca/chlp/,Cambrian College,14-Engineering,College
38787,Ontario,Toronto,Civil Engineering Technology,https://www.georgebrown.ca/programs/civil-engineering-technology-program-t164/?year=2019,George Brown College,14-Engineering,College
37832,Ontario,South Porcupine,Civil Engineering Technology,http://www.northernc.on.ca/civil-engineering,Northern College of Applied Arts and Technology,14-Engineering,College
24652,Alberta,Calgary,Civil Engineering Technology – General,https://www.sait.ca/programs-and-courses/diplomas/civil-engineering-technology,Southern Alberta Institute of Technology (SAIT),14-Engineering,College
18593,Ontario,Stoney Creek,Construction Engineering Technician,http://www.mohawkcollege.ca/skilled-trades-programs/construction-engineering-technician-diploma.html,Mohawk College of Applied Arts and Technology,14-Engineering,College
17996,Ontario,Toronto,Construction Engineering Technician,https://www.georgebrown.ca/programs/construction-engineering-technician-program-t161/?year=2019,George Brown College,14-Engineering,College
15182,Ontario,Windsor,Construction Engineering Technician,http://www.stclaircollege.ca/programs/postsec/construction/,St. Clair College of Applied Arts and Technology,14-Engineering,College
18604,Ontario,Stoney Creek,Construction Engineering Technician - Building Renovation,https://www.mohawkcollege.ca/programs/skilled-trades/construction-engineering-technician-building-renovation-462,Mohawk College of Applied Arts and Technology,14-Engineering,College
17351,Newfoundland and Labrador,Stephenville,Diploma in Aircraft Maintenance EngineeringTechnician,http://www.cna.nl.ca/programs-courses/show-program-details.asp?program=62,College of the North Atlantic,14-Engineering,College
12756,British Columbia,Burnaby,Diploma in Biomedical Engineering Technology,https://www.bcit.ca/study/programs/5063dipma,British Columbia Institute of Technology (BCIT),14-Engineering,College
51834,Ontario,Mssissauga,Diploma in Chemical Process Engineering,https://www.citicollege.ca/program/chemical-process-engineering-program/,Citi College,14-Engineering,College
51834,Ontario,Toronto,Diploma in Chemical Process Engineering,https://www.citicollege.ca/program/chemical-process-engineering-program/,Citi College,14-Engineering,College
35887,British Columbia,Burnaby,Diploma in Civil Engineering,https://www.bcit.ca/study/programs/5410diplt,British Columbia Institute of Technology (BCIT),14-Engineering,College
44293,Ontario,Toronto,Diploma in Civil Engineering Design and Technology,http://www.nacollege.com/index.php/diploma-in-civil-engineering-design-and-technology/,North American College of Information Technology Inc.,14-Engineering,College
30089,British Columbia,Prince George,Diploma in Civil Engineering Technology,http://www.cnc.bc.ca/CNC_Programs/Womens_Studies.htm,College of New Caledonia,14-Engineering,College
37958,Ontario,Toronto,Diploma in Computer Network Engineering Design and Technology,http://www.nacollege.com/courses/course_CNEDT.asp,North American College of Information Technology,14-Engineering,College
44302,Ontario,Scarborough,Diploma in Computer Network Engineering Design and Technology,http://www.nacollege.com/index.php/diploma-in-computer-network-engineering-design-and-technology/,North American College of Information Technology Inc.,14-Engineering,College
44302,Ontario,Toronto,Diploma in Computer Network Engineering Design and Technology,http://www.nacollege.com/index.php/diploma-in-computer-network-engineering-design-and-technology/,North American College of Information Technology Inc.,14-Engineering,College
12855,British Columbia,Victoria,Diploma in Electrical Engineering Technology—Marine & Industrial,http://camosun.ca/learn/programs/electrical-engineering-technology/,Camosun College,14-Engineering,College
44301,Ontario,Toronto,Diploma in Electrical and Electronic Engineering Design Technology,http://www.nacollege.com/index.php/diploma-in-electrical-and-electronic-engineering-design-technology/,North American College of Information Technology Inc.,14-Engineering,College
38728,Ontario,London,Diploma in Manufacturing Engineering Technician - Co-op,https://www.fanshawec.ca/programs/men1-manufacturing-engineering-technician-co-op/next,Fanshawe College of Applied Arts and Technology,14-Engineering,College
12774,British Columbia,North Vancouver,Diploma in Marine Engineering,https://www.bcit.ca/study/programs/2935dipma,British Columbia Institute of Technology (BCIT),14-Engineering,College
44283,Ontario,Toronto,Diploma in Mechanical Engineering Design and Technology,http://www.nacollege.com/index.php/diploma-in-mechanical-engineering-design-and-technology/,North American College of Information Technology Inc.,14-Engineering,College
17829,Newfoundland and Labrador,Stephenville,Diploma in Mechanical Engineering Technology,https://www.cna.nl.ca/program/mechanical-engineering-technology,College of the North Atlantic,14-Engineering,College
51835,Ontario,Mssissauga,Diploma in Paint & Coating Technology,https://www.citicollege.ca/program/paint-coating-technology-program/,Citi College,14-Engineering,College
51835,Ontario,Toronto,Diploma in Paint & Coating Technology,https://www.citicollege.ca/program/paint-coating-technology-program/,Citi College,14-Engineering,College
17868,Newfoundland and Labrador,St. John's,Diploma in Petroleum Engineering Technology (Co-op),https://www.cna.nl.ca/program/petroleum-engineering-technology-co-op,College of the North Atlantic,14-Engineering,College
12816,British Columbia,Burnaby,Diploma in Power and Process Engineering,https://www.bcit.ca/study/programs/2430dipma,British Columbia Institute of Technology (BCIT),14-Engineering,College
34686,Ontario,Sudbury,Electrical Engineering Technology (EETY),http://cambriancollege.ca/programs/electrical-engineering-technology/,Cambrian College,14-Engineering,College
24991,Ontario,Cambridge,Electrical Engineering Technology (Optional Co-op),https://www.conestogac.on.ca/fulltime/electrical-engineering-technology,Conestoga College Institute of Technology and Advanced Learning,14-Engineering,College
25176,Ontario,Toronto,Electrical Techniques,https://appliedtechnology.humber.ca/index.php?q=programs/electrical-techniques.html,Humber College of Applied Arts and Technology,14-Engineering,College
39807,Ontario,Toronto,Electrician: Construction and Maintenance - Electrical Engineering Technician,https://www.centennialcollege.ca/programs-courses/full-time/electrician-construction-maintenance-electrical-engineering-technician/,Centennial College of Applied Arts and Technology,14-Engineering,College
14007,Ontario,Toronto,Electronics Engineering Technician,https://www.centennialcollege.ca/programs-courses/full-time/electronics-engineering-technician/,Centennial College of Applied Arts and Technology,14-Engineering,College
40022,Ontario,Kitchener,Electronics Engineering Technician,https://www.conestogac.on.ca/fulltime/electronics-engineering-technician,Conestoga College Institute of Technology and Advanced Learning,14-Engineering,College
39820,Ontario,Toronto,Electronics Engineering Technician (Fast Track),https://www.centennialcollege.ca/programs-courses/full-time/electronics-engineering-technician-fast-track/,Centennial College of Applied Arts and Technology,14-Engineering,College
39823,Ontario,Toronto,Electronics Engineering Technology (Fast Track),https://www.centennialcollege.ca/programs-courses/full-time/electronics-engineering-technology-fast-track/,Centennial College of Applied Arts and Technology,14-Engineering,College
24992,Ontario,Cambridge,Electronics Engineering Technology (Optional Co-op),https://www.conestogac.on.ca/fulltime/electronics-engineering-technology,Conestoga College Institute of Technology and Advanced Learning,14-Engineering,College
18019,Ontario,Toronto,Electronics Technician (Distance Learning),https://www.georgebrown.ca/apprenticeship/programs/#75161934258,George Brown College,14-Engineering,College
39348,Ontario,Kitchener,Embedded Systems Development (Optional Co-op),https://www.conestogac.on.ca/fulltime/embedded-systems-development,Conestoga College Institute of Technology and Advanced Learning,14-Engineering,College
47001,British Columbia,New Westminster,Engineering Essentials,http://www.douglascollege.ca/programs-courses/catalogue/programs/DPEGESS,Douglas College,14-Engineering,College
19986,British Columbia,New Westminster,Engineering Foundations,http://www.douglascollege.ca/programs-courses/catalogue/programs/CTEGFND,Douglas College,14-Engineering,College
34300,British Columbia,Campbell River,Engineering Foundations Certificate,https://www.nic.bc.ca/programs-courses/university-transfer/science-technology-engineering-math-programs-courses/engineering-foundations-certificate/,North Island College,14-Engineering,College
34300,British Columbia,Courtenay,Engineering Foundations Certificate,https://www.nic.bc.ca/programs-courses/university-transfer/science-technology-engineering-math-programs-courses/engineering-foundations-certificate/,North Island College,14-Engineering,College
34300,British Columbia,Port Alberni,Engineering Foundations Certificate,https://www.nic.bc.ca/programs-courses/university-transfer/science-technology-engineering-math-programs-courses/engineering-foundations-certificate/,North Island College,14-Engineering,College
34300,British Columbia,Port Hardy,Engineering Foundations Certificate,https://www.nic.bc.ca/programs-courses/university-transfer/science-technology-engineering-math-programs-courses/engineering-foundations-certificate/,North Island College,14-Engineering,College
15799,British Columbia,Vancouver,Engineering Transfer Certificate,https://langara.ca/programs-and-courses/programs/engineering/index.html,Langara College,14-Engineering,College
37191,British Columbia,Nanaimo,Engineering Transfer Certificate,https://calendar.viu.ca/science-and-technology/fundamentals-engineering-certificate-program,Vancouver Island University,14-Engineering,College
13200,British Columbia,Abbotsford,Engineering Transfer Program (First-Year),https://www.ufv.ca/calendar/current/ProgramsC-E/ENGR_TRAN.htm,University of the Fraser Valley,14-Engineering,College
39494,Ontario,Cambridge,Environmental - Civil Engineering Technology (Optional Co-op),http://www.conestogac.on.ca/fulltime/environmental-civil-engineering-technology,Conestoga College Institute of Technology and Advanced Learning,14-Engineering,College
24982,Ontario,Cambridge,Environmental Engineering Applications (Optional Co-op),http://www.conestogac.on.ca/fulltime/environmental-engineering-applications,Conestoga College Institute of Technology and Advanced Learning,14-Engineering,College
39442,Alberta,Calgary,First Class Power Engineering Certificate of Achievement,https://www.sait.ca/programs-and-courses/continuing-education/courses-and-certificates/first-class-power-engineering-certificate-of-achievement,Southern Alberta Institute of Technology (SAIT),14-Engineering,College
39706,Ontario,Oshawa,General Arts and Science – Science and Engineering Preparation – Ontario Tech University Transfer,https://durhamcollege.ca/programs/general-arts-and-science-science-and-engineering-preparation-uoit-pathway-stream,Durham College of Applied Arts and Technology,14-Engineering,College
19376,Saskatchewan,Moose Jaw,Geomatics and Surveying Engineering Technology,https://saskpolytech.ca/programs-and-courses/programs/Geomatics-and-Surveying-Engineering-Technology.aspx,Saskatchewan Polytechnic,14-Engineering,College
17692,Ontario,London,Graduate Certificate in Applied Aerospace Manufacturing,https://www.fanshawec.ca/programs/amf2-applied-aerospace-manufacturing/next,Fanshawe College of Applied Arts and Technology,14-Engineering,College
17398,Ontario,London,Graduate Certificate in Applied Mechanical Design,https://www.fanshawec.ca/programs/amd2-applied-mechanical-design/next,Fanshawe College of Applied Arts and Technology,14-Engineering,College
17490,Ontario,London,Graduate Certificate in Electronics and Embedded Systems Development,https://www.fanshawec.ca/programs/esd2-electronics-and-embedded-systems-development/next,Fanshawe College of Applied Arts and Technology,14-Engineering,College
17467,Ontario,London,Graduate Certificate in Practical Elements of Mechanical Engineering,https://www.fanshawec.ca/programs/pem1-practical-elements-mechanical-engineering/next,Fanshawe College of Applied Arts and Technology,14-Engineering,College
37746,Newfoundland and Labrador,Grand Falls-Windsor,Hard Rock Miner,http://keyin.ca/program/hard-rock-miner/,Keyin College,14-Engineering,College
17323,Manitoba,Brandon,Industrial Metals Fabrication,https://assiniboine.net/programs/industrial-metals-fabrication,Assiniboine Community College,14-Engineering,College
46549,Ontario,Kitchener,Manufacturing Engineering,http://www.conestogac.on.ca/parttime/manufacturing-engineering,Conestoga College Institute of Technology and Advanced Learning,14-Engineering,College
39922,Ontario,Owen Sound,Marine Engineering Management,http://www.georgiancollege.ca/academics/full-time-programs/marine-engineering-management-memg/,Georgian College,14-Engineering,College
18219,Ontario,Owen Sound,Marine Engineering Technology (Co-op),https://www.georgiancollege.ca/academics/full-time-programs/marine-engineering-technology-mtcy/,Georgian College,14-Engineering,College
18221,Ontario,Barrie,Mechanical Engineering Technology (Co-op),http://www.georgiancollege.ca/academics/full-time-programs/mechanical-engineering-technology-co-op-mety/,Georgian College,14-Engineering,College
39912,Ontario,Toronto,Mechanical Engineering Technology - Design (Co-op),https://www.centennialcollege.ca/programs-courses/full-time/mechanical-engineering-technology-design/,Centennial College of Applied Arts and Technology,14-Engineering,College
39910,Ontario,Toronto,Mechanical Engineering Technology - Design (Co-op) (Fast-Track),https://www.centennialcollege.ca/programs-courses/full-time/mechanical-engineering-technology-design-fast-track/,Centennial College of Applied Arts and Technology,14-Engineering,College
37752,Newfoundland and Labrador,Grand Falls-Windsor,Mining Mill Processing Operator,http://keyin.ca/program/mining-mill-processing-operator/,Keyin College,14-Engineering,College
45103,Ontario,Brampton,Network Engineering Diploma,http://canilearn.com/index.php/technical-training/network-engineering-diploma/,Canadian Institute of Learning,14-Engineering,College
39956,Alberta,Edmonton,Oil and Gas Production Operator,http://www.nait.ca/program_home_17680.htm,Northern Alberta Institute of Technology (NAIT),14-Engineering,College
2992,British Columbia,Kelowna,Okanagan College Electronic Engineering Technology Bridge to UBC Okanagan Electrical Engineering,https://webapps-5.okanagan.bc.ca/ok/Calendar/ElectronicEngineeringtoUBCOBridge,Okanagan College,14-Engineering,College
38582,British Columbia,Kelowna,Okanagan College to UBC-Okanagan Civil Engineering Bridge,http://webapps-5.okanagan.bc.ca/ok/Calendar/CivilEngineeringBridgeUBCO,Okanagan College,14-Engineering,College
2991,British Columbia,Kelowna,Okanagan College to UBC-Okanagan Mechanical Engineering Bridge,https://webapps-5.okanagan.bc.ca/ok/Calendar/MechanicalEngineeringBridgeUBCO,Okanagan College,14-Engineering,College
39503,Ontario,Cambridge,Packaging Engineering Technician (Optional Co-op),https://www.conestogac.on.ca/fulltime/packaging-engineering-technician,Conestoga College Institute of Technology and Advanced Learning,14-Engineering,College
19747,Alberta,Cold Lake,Power Engineering,http://www.portagecollege.ca/Programs/Trades-and-Technology/Power-Engineering,Portage College,14-Engineering,College
19747,Alberta,Lac La Biche,Power Engineering,http://www.portagecollege.ca/Programs/Trades-and-Technology/Power-Engineering,Portage College,14-Engineering,College
25794,Manitoba,Brandon,Power Engineering,https://assiniboine.net/programs/power-engineering,Assiniboine Community College,14-Engineering,College
19081,Alberta,Edmonton,Power Engineering (Part-Time & Distance),http://www.nait.ca/program_home_98073.htm,Northern Alberta Institute of Technology (NAIT),14-Engineering,College
19687,Saskatchewan,Yorkton,Power Engineering (Third Class),http://www.parklandcollege.sk.ca/programs/industrialagriculture/powerengineering/thirdclass.html,Parkland College,14-Engineering,College
19080,Alberta,Edmonton,Power Engineering Certificate,http://www.nait.ca/program_home_77244.htm,Northern Alberta Institute of Technology (NAIT),14-Engineering,College
40345,Alberta,Grande Prairie,Power Engineering Certificate, Fourth Class,https://www.gprc.ab.ca/programs/pe-fourth-class.html,Grande Prairie Regional College,14-Engineering,College
14308,Alberta,Grande Prairie,Power Engineering Certificate, Third Class,https://www.gprc.ab.ca/programs/pe-third-class.html,Grande Prairie Regional College,14-Engineering,College
15172,Saskatchewan,Estevan,Power Engineering Fourth Class,https://www.southeastcollege.org/courses/power-engineering-fourth-class/,Southeast Regional College,14-Engineering,College
31678,Ontario,Thunder Bay,Power Engineering Technician,http://www.confederationcollege.ca/program/power-engineering-technician,Confederation College of Applied Arts and Technology,14-Engineering,College
